{
  "schemaVersion": "1.0",
  "deckId": "why-ppagent",
  "title": "为什么做 PPagenT",
  "communicationJob": "说明 PPagenT 的核心理念：解决做 PPT 中真正费时间的判断问题，用 AI 理解、规则决定、代码执行的机制，稳定交付 80 分的好用初稿。",
  "audience": "潜在的用户、合作者或投资人，可能包括学校、企业、实验室和个人。",
  "audienceOutcome": "理解 PPagenT 的价值主张，认同其理念，并对其产生兴趣或支持。",
  "centralTakeaway": "做 PPT 真正费时间的是反复发生的判断；PPagenT 用 AI 理解、规则决定、代码执行，稳定交付工作中真正可用的 80 分初稿。",
  "narrativeArc": [
    "问题：做 PPT 真正费时间的是什么？",
    "误区：每次都不一样不一定是好事。",
    "方法：AI、规则与代码如何分工。",
    "价值：稳定 80 分比随机 95 分更值钱。",
    "愿景：让更多人获得好用的 PPT。"
  ],
  "pages": [
    {
      "pageId": "p1",
      "sequence": 1,
      "narrativeJob": "核心论点：做 PPT 真正费时间的不是画，而是一连串判断。",
      "sourceAnchors": [
        "## 做 PPT，真正费时间的不是“画”",
        "真正费时间的不是把文本框拖到左边还是右边，而是一连串判断",
        "所以",
        "既然一个高手已经知道怎样做是好的，为什么每次还要重新做一遍？"
      ]
    },
    {
      "pageId": "p2",
      "sequence": 2,
      "narrativeJob": "工作场景中，固定比自由更重要。",
      "sourceAnchors": [
        "## 工作里的 PPT，不需要每次重新发明",
        "每次都不一样，有时候才是缺点。",
        "学校有学校的样子，企业有企业的样子",
        "PPagenT 会主动牺牲一部分自由，换取可靠、稳定和效率。"
      ]
    },
    {
      "pageId": "p3",
      "sequence": 3,
      "narrativeJob": "介绍 AI、规则、代码的分工。",
      "sourceAnchors": [
        "## AI 负责理解，规则负责决定，代码负责执行",
        "AI 负责理解。",
        "规则负责决定。",
        "代码负责执行。",
        "AI 读懂稿子，然后调用人已经提前做好的好东西。"
      ]
    },
    {
      "pageId": "p4",
      "sequence": 4,
      "narrativeJob": "对比稳定 80 分与随机 95 分，强调稳定更值钱。",
      "sourceAnchors": [
        "## 稳定的 80 分，比随机的 95 分更值钱",
        "PPagenT 不追求每次都生成一个让人惊叹的 95 分作品。",
        "如果系统能够稳定交付一个真正能用于工作的 80 分初稿，它就已经节省了大量时间。",
        "对工作来说，稳定的 80 分，很多时候比随机的 95 分更值钱。"
      ]
    },
    {
      "pageId": "p5",
      "sequence": 5,
      "narrativeJob": "说明 PPagenT 不只为极少数高手，而是服务更广人群。",
      "sourceAnchors": [
        "## 不只服务最会做 PPT 的那 1%",
        "最会做 PPT 的少数人也许并不需要 PPagenT。",
        "但更多的人有内容、有专业知识，也有真实的汇报任务",
        "如果能够把少数熟练制作者已经掌握的方法做成系统",
        "PPagenT 不需要让所有人成为设计师。"
      ]
    },
    {
      "pageId": "p6",
      "sequence": 6,
      "narrativeJob": "阐述真正的积累是经验而非模板数量，且可扩展。",
      "sourceAnchors": [
        "## 真正积累的不是一万个模板",
        "现实中的内容永远不可能被模板穷尽。",
        "所以 PPagenT 真正要积累的不是页面数量，而是页面背后的经验",
        "东北大学可以是第一个落地场景，但不会是 PPagenT 的最终边界。"
      ]
    },
    {
      "pageId": "p7",
      "sequence": 7,
      "narrativeJob": "总结愿景：让不会做 PPT 的人也能得到靠谱、好用、可修改的 PPT。",
      "sourceAnchors": [
        "## 最后，它想解决的是一件很普通的事",
        "做一套好 PPT 太费时间了",
        "PPagenT 想把一个很会做 PPT 的人的经验留下来",
        "不一定惊艳，但靠谱；不一定独一无二，但真的好用；而且第二天还可以继续修改的 PPT。",
        "如果能做到这一点，这个项目就值得做。"
      ]
    }
  ]
}
