{
  "schemaVersion": "1.0",
  "deckId": "ppagent-mechanism-validation",
  "title": "为什么做 PPagenT：第六页机制验证",
  "communicationJob": "说明 PPagenT 的核心积累是页面背后的经验规律而非模板数量，并指出其可扩展性。",
  "audience": "内部团队或利益相关者",
  "audienceOutcome": "理解 PPagenT 的长期价值在于提炼可复用的表达规律，而非堆砌模板。",
  "centralTakeaway": "PPagenT 真正积累的是从作品到能力的经验规律，可服务于更广泛的场景。",
  "narrativeArc": [
    "问题：模板无法穷尽内容",
    "洞察：积累规律而非模板",
    "转化：从作品到能力",
    "展望：超越单一场景"
  ],
  "pages": [
    {
      "pageId": "p1",
      "sequence": 1,
      "narrativeJob": "承接原稿，引出核心观点，并证明从作品到能力的转化",
      "sourceAnchors": [
        "## 真正积累的不是一万个模板"
      ]
    }
  ]
}
