{
  "schemaVersion": "1.0",
  "deckId": "why-ppagent",
  "title": "为什么做 PPagenT",
  "communicationJob": "解释PPagenT的动机、工作原理与价值主张，使目标受众理解并认可其必要性。",
  "audience": "对高效制作演示有需求的团队/个人，产品与技术决策者",
  "audienceOutcome": "理解PPT制作中真正的成本是判断，认同PPagenT以AI理解、规则决策、代码执行的方式稳定交付可编辑的80分作品。",
  "centralTakeaway": "PPagenT通过AI理解、规则决策、代码执行的三方分工，将资深PPT制作者的经验系统化，为广泛用户提供稳定、可靠、可修改的80分演示文稿。",
  "narrativeArc": [
    "判断，而非画图，才是PPT的真正成本",
    "一致性优先于随机：工作场景需要固定",
    "分工协作：AI理解，规则决定，代码执行",
    "稳定80分胜过随机95分",
    "经验积累与面向广泛用户"
  ],
  "pages": [
    {
      "pageId": "page1",
      "sequence": 1,
      "narrativeJob": "提出核心矛盾：制作PPT的时间主要花在判断而非视觉排版上。",
      "sourceAnchors": [
        "做 PPT，真正费时间的不是“画”"
      ]
    },
    {
      "pageId": "page2",
      "sequence": 2,
      "narrativeJob": "论证工作场景中一致性优于创新，固定风格意味着验证过。",
      "sourceAnchors": [
        "工作里的 PPT，不需要每次重新发明"
      ]
    },
    {
      "pageId": "page3",
      "sequence": 3,
      "narrativeJob": "介绍PPagenT的三大分工：AI理解、规则决定、代码执行。",
      "sourceAnchors": [
        "AI 负责理解，规则负责决定，代码负责执行"
      ]
    },
    {
      "pageId": "page4",
      "sequence": 4,
      "narrativeJob": "阐明价值主张：稳定的80分比随机的95分更能服务于实际工作。",
      "sourceAnchors": [
        "稳定的 80 分，比随机的 95 分更值钱"
      ]
    },
    {
      "pageId": "page5",
      "sequence": 5,
      "narrativeJob": "明确目标受众：服务大多数有内容但缺乏呈现能力的人。",
      "sourceAnchors": [
        "不只服务最会做 PPT 的那 1%"
      ]
    },
    {
      "pageId": "page6",
      "sequence": 6,
      "narrativeJob": "阐述积累的本质：不是模板而是经验规律；场景可扩展。",
      "sourceAnchors": [
        "真正积累的不是一万个模板"
      ]
    },
    {
      "pageId": "page7",
      "sequence": 7,
      "narrativeJob": "收束全文：解决一个普遍痛点，让非专业者获得可靠的PPT产出。",
      "sourceAnchors": [
        "最后，它想解决的是一件很普通的事"
      ]
    }
  ]
}
